{
  "$schema": "http://json-schema.org/draft-07/schema#",
  "$id": "docs/contracts/SEC-05/SecurityDetectionType.json",
  "title": "SecurityDetectionType",
  "description": "安全检测事件类型枚举。用于安全审计日志和异常分类。由设计文档 1.1 异常检测分类确定。",
  "type": "string",
  "x-defined-by": "SEC-05",
  "x-consumers": [],
  "x-maturity": "draft",
  "x-contract-type": "shared-enum",
  "x-version": "1.0.0",
  "enum": ["sql_injection", "xss_payload", "malformed_request"]
}
