{
  "$schema": "http://json-schema.org/draft-07/schema#",
  "$id": "docs/contracts/PROF-01/ProfileBehaviorType.json",
  "title": "ProfileBehaviorType",
  "description": "个人档案主要行为类型枚举，定义孤独症患者最常出现的行为特征类别（单值必填）。用于个人档案的必填字段 primary_behavior。与 CASE-01 的 BehaviorType（案例核心行为问题分类）业务域不同：PROF-01 面向个体患者特征分类，CASE-01 面向案例审核筛选及模板聚类。两枚举语义重叠约 67%（4/6 项相似）但值集合不同，经契约协调确认保持独立（同名异构，medium 冲突已解决——本模块使用 ProfileBehaviorType 命名以避碰）。",
  "type": "string",
  "x-defined-by": "PROF-01",
  "x-consumers": ["PROF-02", "PROF-07"],
  "x-maturity": "draft",
  "x-contract-type": "shared-enum",
  "x-version": "1.0.0",
  "enum": ["刻板行为", "情绪崩溃", "自伤行为", "攻击行为", "社交退缩", "多动"]
}
