{
  "$schema": "http://json-schema.org/draft-07/schema#",
  "$id": "docs/contracts/CASE-01/SeverityLevel.json",
  "title": "SeverityLevel",
  "description": "案例对应的行为严重程度等级，三级分类。用于案例检索过滤和审核阶段严重程度评估。",
  "type": "string",
  "x-defined-by": "CASE-01",
  "x-consumers": ["CASE-03", "CASE-09"],
  "x-maturity": "draft",
  "x-contract-type": "shared-enum",
  "x-version": "1.0.0",
  "enum": ["轻度", "中度", "重度"]
}
