{
  "$schema": "http://json-schema.org/draft-07/schema#",
  "$id": "docs/contracts/PROF-01/LanguageLevel.json",
  "title": "LanguageLevel",
  "description": "患者语言沟通能力评估等级枚举。用于个人档案的可选字段 language_level。",
  "type": "string",
  "x-defined-by": "PROF-01",
  "x-consumers": ["PROF-02", "PROF-07"],
  "x-maturity": "draft",
  "x-contract-type": "shared-enum",
  "x-version": "1.0.0",
  "enum": ["无语言", "单字词", "短句", "可对话"]
}
