{
  "$schema": "http://json-schema.org/draft-07/schema#",
  "$id": "docs/contracts/PROF-01/AgeRange.json",
  "title": "AgeRange",
  "description": "患者年龄区间枚举，由出生日期实时计算得出（不持久化存储）。用于个人档案输出字段 age_range 和下游 PROF-02 的检索过滤。",
  "type": "string",
  "x-defined-by": "PROF-01",
  "x-consumers": ["PROF-02", "PROF-07"],
  "x-maturity": "draft",
  "x-contract-type": "shared-enum",
  "x-version": "1.0.0",
  "enum": ["0-3岁", "4-6岁", "7-12岁", "13-18岁", "18岁以上"]
}
