{
  "$schema": "http://json-schema.org/draft-07/schema#",
  "$id": "docs/contracts/OBS-01/LogLevel.json",
  "title": "LogLevel",
  "description": "日志严重等级枚举，用于标记每条日志的严重程度",
  "type": "string",
  "enum": ["DEBUG", "INFO", "WARNING", "ERROR"],
  "x-defined-by": "OBS-01",
  "x-consumers": [],
  "x-maturity": "draft",
  "x-contract-type": "shared-enum",
  "x-version": "1.0.0"
}
