{
  "$schema": "http://json-schema.org/draft-07/schema#",
  "$id": "docs/contracts/PROF-01/SensoryFeature.json",
  "title": "SensoryFeature",
  "description": "患者感官特征枚举，定义孤独症人士常见的感官反应类别（可多选）。用于个人档案的可选字段 sensory_features（最多 6 项）。下游 PROF-02 消费此类型构建检索过滤条件。",
  "type": "string",
  "x-defined-by": "PROF-01",
  "x-consumers": ["PROF-02", "PROF-07"],
  "x-maturity": "draft",
  "x-contract-type": "shared-enum",
  "x-version": "1.0.0",
  "enum": ["听觉敏感", "触觉敏感", "味觉敏感", "视觉敏感", "前庭寻求", "本体觉寻求"]
}
