{
  "$schema": "http://json-schema.org/draft-07/schema#",
  "$id": "docs/contracts/AUTH-06/SessionState.json",
  "title": "SessionState",
  "description": "前端认证会话状态枚举，由 AUTH-06 管理，通过 useAuth Hook 暴露给所有下游 L1b/L1a 模块感知",
  "type": "string",
  "enum": ["authenticated", "refreshing", "unauthenticated"],
  "x-defined-by": "AUTH-06",
  "x-consumers": ["AUTH-05", "CSLT-07", "CSLT-08", "PROF-06", "PROF-07", "CASE-08", "CASE-09", "TICK-08", "TICK-09", "KNOW-06", "KNOW-07"],
  "x-maturity": "draft",
  "x-contract-type": "shared-enum",
  "x-version": "1.0.0"
}
