{
  "$schema": "http://json-schema.org/draft-07/schema#",
  "$id": "docs/contracts/CASE-01/SceneType.json",
  "title": "SceneType",
  "description": "干预事件发生的环境场所分类，共五类。用于案例检索时的场景过滤和案例分类统计。",
  "type": "string",
  "x-defined-by": "CASE-01",
  "x-consumers": ["CASE-03", "CASE-09", "CSLT-02"],
  "x-maturity": "draft",
  "x-contract-type": "shared-enum",
  "x-version": "1.0.0",
  "enum": ["家庭", "学校", "公共场合", "机构", "不限"]
}
