{
  "$schema": "http://json-schema.org/draft-07/schema#",
  "$id": "docs/contracts/PROF-01/Trigger.json",
  "title": "Trigger",
  "description": "已知触发因素枚举，定义可能引发患者情绪波动或行为问题的环境/情境因素（可多选）。用于个人档案的可选字段 triggers（最多 7 项）。",
  "type": "string",
  "x-defined-by": "PROF-01",
  "x-consumers": ["PROF-02", "PROF-07"],
  "x-maturity": "draft",
  "x-contract-type": "shared-enum",
  "x-version": "1.0.0",
  "enum": ["噪音", "环境变化", "陌生人", "任务中断", "社交压力", "感官过载", "身体不适"]
}
