{
  "$schema": "http://json-schema.org/draft-07/schema#",
  "$id": "docs/contracts/KNOW-01/ArticleCategory.json",
  "title": "ArticleCategory",
  "description": "科普文章所属分类枚举，决定文章在前端分类导航中的展示位置和过滤维度",
  "type": "string",
  "enum": ["术语解释", "干预方法", "诊断标准", "康复指南"],
  "x-defined-by": "KNOW-01",
  "x-consumers": ["KNOW-03", "KNOW-06", "KNOW-07"],
  "x-maturity": "draft",
  "x-contract-type": "shared-enum",
  "x-version": "1.0.0"
}
