{
  "$schema": "http://json-schema.org/draft-07/schema#",
  "$id": "docs/contracts/PROF-03/SeverityLevel.json",
  "title": "SeverityLevel",
  "description": "家属自评事件严重程度枚举，三值（轻/中/重）。注意：CASE-01/SeverityLevel.json 存在同名文件（取值 ['轻度','中度','重度']）但未注册到 _index.json 全局索引。两者业务域不同——PROF-03 面向家属对单次事件的即时主观评估（短形式适合移动端快速选择），CASE-01 面向案例审核的结构化严重度标准。经契约协调确认保持独立（同名异构，轻冲突）。",
  "type": "string",
  "x-defined-by": "PROF-03",
  "x-consumers": ["PROF-02", "PROF-07"],
  "x-maturity": "draft",
  "x-contract-type": "shared-enum",
  "x-version": "1.0.0",
  "enum": ["轻", "中", "重"]
}
